{
  "schema_version": "try4_repair_contract_v1",
  "part_id": "R02_P03",
  "round": 2,
  "status": "REPLAN",
  "failed_gates": [
    "iou",
    "normalized_chamfer",
    "normalized_hd95"
  ],
  "violations": [
    {
      "region": "whole_part",
      "feature_id": "F00",
      "type": "wrong_shape_family",
      "severity": "critical",
      "requirement": "long narrow beam between roll housing and fork",
      "evidence_views": [
        "isolated_front",
        "isolated_side",
        "isolated_top",
        "isolated_isometric"
      ],
      "measured_difference": {
        "previous_metrics": {
          "voxel_iou": 0.1348549265309166,
          "normalized_chamfer": 0.0870890682456865,
          "normalized_hd95": 0.2394021880578197
        },
        "diagnosis": "Round 1 improved IoU/Chamfer but HD95 regressed and was rolled back; use a less shortened transition"
      }
    }
  ],
  "repair_actions": [
    {
      "priority": 1,
      "action": "FULL_PART_REPLAN",
      "feature_id": "F00",
      "target_region": "whole_part",
      "cad_strategy": "structured round 2 replan",
      "parameters": {
        "parameter_updates": {
          "length": 200,
          "offset": 14,
          "start_size": [
            54,
            42
          ],
          "end_size": [
            36,
            28
          ],
          "joint_radius": 27,
          "joint_height": 64,
          "channel_depth": 26,
          "channel_width": 56,
          "channel_height": 19
        }
      }
    }
  ],
  "protected_features": [],
  "do_not_change": [
    "semantic_role",
    "interface_semantics",
    "declared_open_spaces"
  ],
  "review_inputs": {
    "gt_renders": "artifacts/R02/isolated/R02_P03",
    "generated_renders": "T1\\R02_P03\\round_0\\renders",
    "semantic_label": "elbow and forearm-roll housing",
    "lod": "skills/robot_part_modeling_standard/SKILL.md",
    "feature_graph": "T1\\R02_P03\\round_0\\feature_graph.json",
    "feature_tree": "T1\\R02_P03\\round_0\\feature_tree.json",
    "deterministic_metrics": "results/phase5_metrics.csv#R02_P03,T1",
    "regional_discrepancies": "results/phase6_regional_discrepancies.csv#R02_P03",
    "previous_history": [
      {
        "round": 1,
        "contract_status": "REPLAN",
        "candidate_gate": "LOCAL_REPAIR",
        "accepted": false,
        "regression": true,
        "new_failed_gates": [],
        "improved": true,
        "resulting_state": "REPLAN"
      }
    ]
  }
}
