{
  "schema_version": "try4_repair_contract_v1",
  "part_id": "R02_P02",
  "round": 1,
  "status": "LOCAL_REPAIR",
  "failed_gates": [
    "iou"
  ],
  "violations": [
    {
      "region": "main_carrier",
      "feature_id": "F00",
      "type": "layout_error",
      "severity": "medium",
      "requirement": "long narrow web and widened end carriers",
      "evidence_views": [
        "isolated_front",
        "isolated_side",
        "isolated_top",
        "isolated_isometric"
      ],
      "measured_difference": {
        "voxel_iou": 0.3113936674146098,
        "normalized_chamfer": 0.030437186298285,
        "normalized_hd95": 0.1061373425576687,
        "bbox_delta_generated_minus_gt_mm": [
          14.906548256484797,
          -15.033896353701564,
          -26.05721037614921
        ],
        "diagnosis": "paired members are spaced too broadly relative to the narrow reference web"
      }
    }
  ],
  "repair_actions": [
    {
      "priority": 1,
      "action": "MODIFY_PARAMETER",
      "feature_id": "F00",
      "target_region": "main_carrier",
      "cad_strategy": "structured parameterized local_repair",
      "parameters": {
        "parameter_updates": {
          "separation": 38,
          "plate_width": 40,
          "carrier_width": 58
        }
      }
    }
  ],
  "protected_features": [
    "F02"
  ],
  "do_not_change": [
    "semantic_role",
    "interface_semantics",
    "declared_open_spaces"
  ],
  "review_inputs": {
    "gt_renders": "artifacts/R02/isolated/R02_P02",
    "generated_renders": "T1/R02_P02/round_0/renders",
    "semantic_label": "upper-arm side frame",
    "lod": "skills/robot_part_modeling_standard/SKILL.md",
    "feature_graph": "T1/R02_P02/round_0/feature_graph.json",
    "feature_tree": "T1/R02_P02/round_0/feature_tree.json",
    "deterministic_metrics": "results/phase5_metrics.csv#R02_P02,T1",
    "regional_discrepancies": "results/phase6_regional_discrepancies.csv#R02_P02",
    "previous_history": []
  }
}
