{
  "schema_version": "try4_repair_contract_v1",
  "part_id": "R01_P02",
  "round": 3,
  "status": "LOCAL_REPAIR",
  "failed_gates": [
    "iou"
  ],
  "violations": [
    {
      "region": "paired_plate_spacing",
      "feature_id": "F00",
      "type": "dimension_error",
      "severity": "medium",
      "requirement": "two separated long side plates and cross carrier",
      "evidence_views": [
        "isolated_front",
        "isolated_side",
        "isolated_top",
        "isolated_isometric"
      ],
      "measured_difference": {
        "previous_metrics": {
          "voxel_iou": 0.3402645113886848,
          "normalized_chamfer": 0.03857864561732078,
          "normalized_hd95": 0.10787576489732097
        },
        "diagnosis": "Round 2 tightening regressed; use a small expansion around accepted Round 1"
      }
    }
  ],
  "repair_actions": [
    {
      "priority": 1,
      "action": "MODIFY_PARAMETER",
      "feature_id": "F00",
      "target_region": "paired_plate_spacing",
      "cad_strategy": "structured round 3 local_repair",
      "parameters": {
        "parameter_updates": {
          "separation": 35
        }
      }
    }
  ],
  "protected_features": [
    "F03"
  ],
  "do_not_change": [
    "semantic_role",
    "interface_semantics",
    "declared_open_spaces"
  ],
  "review_inputs": {
    "gt_renders": "artifacts/R01/isolated/R01_P02",
    "generated_renders": "T2\\R01_P02\\round_1\\renders",
    "semantic_label": "upper-arm carrier assembly",
    "lod": "skills/robot_part_modeling_standard/SKILL.md",
    "feature_graph": "T2\\R01_P02\\round_1\\feature_graph.json",
    "feature_tree": "T2\\R01_P02\\round_1\\feature_tree.json",
    "deterministic_metrics": "T2\\R01_P02\\round_1\\metrics.json",
    "regional_discrepancies": "results/phase6_regional_discrepancies.csv#R01_P02",
    "previous_history": [
      {
        "round": 1,
        "contract_status": "LOCAL_REPAIR",
        "candidate_gate": "LOCAL_REPAIR",
        "accepted": true,
        "regression": false,
        "new_failed_gates": [],
        "improved": true,
        "resulting_state": "LOCAL_REPAIR"
      },
      {
        "round": 2,
        "contract_status": "LOCAL_REPAIR",
        "candidate_gate": "LOCAL_REPAIR",
        "accepted": false,
        "regression": true,
        "new_failed_gates": [],
        "improved": false,
        "resulting_state": "LOCAL_REPAIR"
      }
    ]
  }
}
